{
  "$schema": "../schemas/adapter.schema.json",
  "schema": 1,
  "id": "dosbox-pure-unleashed-windows-x64",
  "platform": "windows",
  "architecture": "amd64",
  "executable": "DOSBoxPure.exe",
  "version": {
    "kind": "artifact-sha256"
  },
  "source": {
    "provider": "forgejo",
    "host": "https://codeberg.org",
    "repository": "schelling/dosbox-pure-unleashed",
    "asset_pattern": "^dosbox_pure_unleashed-windows-64bit-.*\\.zip$",
    "checksum": "when-published"
  },
  "preserve": [],
  "required_package": [
    "DOSBoxPure.exe"
  ],
  "required_state": []
}
